{
  "$schema": "https://json-schema.org/draft/2020-12/schema",
  "$id": "https://agentic-engineering.dev/schemas/evaluation-report.schema.json",
  "title": "Deterministic Evaluation Report",
  "type": "object",
  "additionalProperties": false,
  "dependentRequired": {
    "target_results": ["scores"],
    "scores": ["target_results"]
  },
  "required": [
    "version",
    "contract_id",
    "work_item_id",
    "spec_id",
    "outcome",
    "criterion_results",
    "evaluator_results",
    "regressions",
    "report_id",
    "fingerprint"
  ],
  "properties": {
    "version": { "const": 1 },
    "contract_id": { "$ref": "#/$defs/id" },
    "work_item_id": { "$ref": "#/$defs/id" },
    "spec_id": { "$ref": "#/$defs/id" },
    "outcome": { "enum": ["pass", "fail", "error"] },
    "criterion_results": {
      "type": "array",
      "items": {
        "type": "object",
        "additionalProperties": false,
        "required": ["criterion_id", "required", "outcome", "evaluator_ids"],
        "properties": {
          "criterion_id": { "$ref": "#/$defs/id" },
          "target_id": { "$ref": "#/$defs/id" },
          "required": { "type": "boolean" },
          "outcome": { "enum": ["pass", "fail", "error"] },
          "evaluator_ids": {
            "type": "array",
            "items": { "$ref": "#/$defs/id" },
            "uniqueItems": true
          }
        }
      }
    },
    "target_results": {
      "type": "array",
      "items": {
        "type": "object",
        "additionalProperties": false,
        "required": ["target_id", "outcome", "criterion_ids"],
        "properties": {
          "target_id": { "$ref": "#/$defs/id" },
          "outcome": { "enum": ["pass", "fail", "error"] },
          "criterion_ids": {
            "type": "array",
            "minItems": 1,
            "items": { "$ref": "#/$defs/id" },
            "uniqueItems": true
          }
        }
      }
    },
    "scores": {
      "type": "object",
      "additionalProperties": false,
      "required": ["targets_passed", "targets_total", "target_completion", "strict_target_completion"],
      "properties": {
        "targets_passed": { "type": "integer", "minimum": 0 },
        "targets_total": { "type": "integer", "minimum": 1 },
        "target_completion": { "type": "number", "minimum": 0, "maximum": 1 },
        "strict_target_completion": { "type": "number", "minimum": 0, "maximum": 1 }
      }
    },
    "evaluator_results": {
      "type": "array",
      "items": {
        "type": "object",
        "additionalProperties": false,
        "required": ["evaluator_id", "type", "outcome", "summary", "artifact_refs", "details"],
        "properties": {
          "evaluator_id": { "$ref": "#/$defs/id" },
          "type": { "enum": ["command", "artifact", "rubric", "world_state"] },
          "outcome": { "enum": ["pass", "fail", "error"] },
          "summary": { "type": "string", "minLength": 1 },
          "artifact_refs": {
            "type": "array",
            "items": { "type": "string", "minLength": 1 },
            "uniqueItems": true
          },
          "details": { "type": "object" }
        }
      }
    },
    "regressions": {
      "type": "array",
      "items": { "$ref": "#/$defs/id" },
      "uniqueItems": true
    },
    "report_id": { "$ref": "#/$defs/id" },
    "fingerprint": { "type": "string", "pattern": "^[a-f0-9]{64}$" }
  },
  "$defs": {
    "id": { "type": "string", "pattern": "^[A-Za-z0-9][A-Za-z0-9._-]*$" }
  }
}
